"";"code_ecole";"nom_ecole";"commune";"academie";"densite";"secteur";"rep";"classes";"eleves"
"18954";"0451167Z";"ECOLE MATERNELLE PUBLIQUE CHENE MAILLARD";"SARAN";"ORLEANS-TOURS";"Ceintures urbaines";"PUBLIC";0;7;184
"18955";"0451180N";"ECOLE ELEMENTAIRE PUBLIQUE LES SABLONNIERES";"SARAN";"ORLEANS-TOURS";"Ceintures urbaines";"PUBLIC";0;14;347
"18967";"0451197G";"ECOLE MATERNELLE PUBLIQUE LA CERISAIE";"OLIVET";"ORLEANS-TOURS";"Grands centres urbains";"PUBLIC";0;5;123
"18977";"0451211X";"ECOLE MATERNELLE PUBLIQUE ALBERT CAMUS";"CHECY";"ORLEANS-TOURS";"Ceintures urbaines";"PUBLIC";0;6;156
"18994";"0451269K";"ECOLE PRIMAIRE PUBLIQUE JACQUES PREVERT";"OUZOUER-SUR-TREZEE";"ORLEANS-TOURS";"Bourgs ruraux";"PUBLIC";0;4;95
"19023";"0451372X";"ECOLE PRIMAIRE PUBLIQUE LES POTIERES";"MEUNG-SUR-LOIRE";"ORLEANS-TOURS";"Petites villes";"PUBLIC";0;7;159
"19034";"0451399B";"ECOLE ELEMENTAIRE PUBLIQUE LOUISE MICHEL";"SAINT-JEAN-DE-BRAYE";"ORLEANS-TOURS";"Grands centres urbains";"PUBLIC";0;7;165
"19083";"0451574S";"ECOLE MATERNELLE PUBLIQUE GISELE BUNEL";"ONDREVILLE-SUR-ESSONNE";"ORLEANS-TOURS";"Rural à habitat dispersé";"PUBLIC";0;3;75
"19113";"0460164D";"ECOLE PRIMAIRE PUBLIQUE -";"LACHAPELLE-AUZAC";"TOULOUSE";"Bourgs ruraux";"PUBLIC";0;4;77
"19286";"0470139W";"ECOLE ELEMENTAIRE PUBLIQUE -";"ENGAYRAC";"BORDEAUX";"Rural à habitat très dispersé";"PUBLIC";0;1;19
"19423";"0470377E";"ECOLE ELEMENTAIRE PUBLIQUE -";"BLANQUEFORT-SUR-BRIOLANCE";"BORDEAUX";"Rural à habitat très dispersé";"PUBLIC";0;1;23
"19425";"0470385N";"ECOLE PRIMAIRE PUBLIQUE -";"CUZORN";"BORDEAUX";"Rural à habitat dispersé";"PUBLIC";0;3;43
"19477";"0470515E";"ECOLE PRIMAIRE PUBLIQUE -";"LAVERGNE";"BORDEAUX";"Rural à habitat dispersé";"PUBLIC";0;3;62
"19513";"0470593P";"ECOLE PRIMAIRE PUBLIQUE -";"FRANCESCAS";"BORDEAUX";"Rural à habitat dispersé";"PUBLIC";0;4;85
"19530";"0470633H";"ECOLE PRIMAIRE PUBLIQUE -";"PUCH-D'AGENAIS";"BORDEAUX";"Rural à habitat très dispersé";"PUBLIC";0;3;70
"19553";"0470709R";"ECOLE ELEMENTAIRE PUBLIQUE EDOUARD LACOUR";"LE PASSAGE";"BORDEAUX";"Centres urbains intermédiaires";"PUBLIC";0;9;179
"19575";"0470813D";"ECOLE MATERNELLE PUBLIQUE -";"CASTELCULIER";"BORDEAUX";"Ceintures urbaines";"PUBLIC";0;3;67
"19612";"0480157K";"ECOLE PRIMAIRE PUBLIQUE -";"MONT LOZERE ET GOULET";"MONTPELLIER";"Rural à habitat dispersé";"PUBLIC";0;3;41
"19630";"0480273L";"ECOLE PRIMAIRE PUBLIQUE JACQUELINE ET EDMOND FOURNIER";"RIMEIZE";"MONTPELLIER";"Rural à habitat très dispersé";"PUBLIC";0;3;36
"19683";"0480582X";"ECOLE PRIMAIRE PUBLIQUE LES SOURCES";"LA CANOURGUE";"MONTPELLIER";"Bourgs ruraux";"PUBLIC";0;6;79
"19689";"0480655B";"ECOLE PRIMAIRE PUBLIQUE -";"VENTALON EN CEVENNES";"MONTPELLIER";"Rural à habitat très dispersé";"PUBLIC";0;2;18
"19775";"0490360A";"ECOLE ELEMENTAIRE PUBLIQUE LES GARENNES";"OREE D'ANJOU";"NANTES";"#N/A";"PUBLIC";0;5;109
"19831";"0490583T";"ECOLE PRIMAIRE PUBLIQUE LE PETIT ANJOU";"ANGRIE";"NANTES";"Rural à habitat dispersé";"PUBLIC";0;4;84
"19892";"0490732E";"ECOLE ELEMENTAIRE PUBLIQUE CALIXTE BAUDIN";"BRISSAC LOIRE AUBANCE";"NANTES";"Bourgs ruraux";"PUBLIC";0;2;53
"19921";"0490930V";"ECOLE MATERNELLE PUBLIQUE LES JARDINS";"BRISSAC LOIRE AUBANCE";"NANTES";"Bourgs ruraux";"PUBLIC";0;3;80
"19966";"0491142A";"ECOLE PRIMAIRE PRIVEE NOTRE DAME";"TUFFALUN";"NANTES";"Rural à habitat dispersé";"PRIVE";0;4;89
"19981";"0491181T";"ECOLE PRIMAIRE PRIVEE DE L'ABBAYE A";"SAUMUR";"NANTES";"Petites villes";"PRIVE";0;6;129
"19982";"0491183V";"ECOLE PRIMAIRE PRIVEE SAINTE-ANNE A";"SAUMUR";"NANTES";"#N/A";"PRIVE";0;3;55
"20072";"0491376E";"ECOLE PRIMAIRE PRIVEE JULIE BODINIER";"RIVES-DU-LOIR-EN-ANJOU";"NANTES";"Bourgs ruraux";"PRIVE";0;4;88
"20182";"0491640S";"ECOLE MATERNELLE PUBLIQUE LES PIERRES BLEUES";"SEGRE-EN-ANJOU BLEU";"NANTES";"Bourgs ruraux";"PUBLIC";0;4;77
"20230";"0491744E";"ECOLE PRIMAIRE PUBLIQUE LE CHATEAU";"BOUCHEMAINE";"NANTES";"Ceintures urbaines";"PUBLIC";0;10;201
"20373";"0500375L";"ECOLE ELEMENTAIRE PUBLIQUE RPI DE LA BAIE";"COURTILS";"NORMANDIE";"Rural à habitat dispersé";"PUBLIC";0;2;37
"20440";"0500852E";"ECOLE MATERNELLE PUBLIQUE -";"SAINT-JACQUES-DE-NEHOU";"NORMANDIE";"Rural à habitat très dispersé";"PUBLIC";0;2;43
"20512";"0501318L";"ECOLE PRIMAIRE PRIVEE ECOLE NOTRE-DAME";"CARENTAN-LES-MARAIS";"NORMANDIE";"Petites villes";"PRIVE";0;16;317
"20603";"0501604X";"ECOLE PRIMAIRE PUBLIQUE -";"BRETTEVILLE";"NORMANDIE";"Rural à habitat dispersé";"PUBLIC";0;3;67
"20605";"0501610D";"ECOLE MATERNELLE PUBLIQUE SUZANNE BRES (LA GLACERIE)";"CHERBOURG-EN-COTENTIN";"NORMANDIE";"Grands centres urbains";"PUBLIC";0;3;62
"20653";"0501747C";"ECOLE MATERNELLE PUBLIQUE -";"ISIGNY-LE-BUAT";"NORMANDIE";"Rural à habitat très dispersé";"PUBLIC";0;6;130
"20656";"0501750F";"ECOLE PRIMAIRE PUBLIQUE -";"DANGY";"NORMANDIE";"Rural à habitat dispersé";"PUBLIC";0;3;66
"20670";"0501806S";"ECOLE MATERNELLE PUBLIQUE (VASTEVILLE)";"LA HAGUE";"NORMANDIE";"Rural à habitat dispersé";"PUBLIC";0;3;62
"20685";"0501835Y";"ECOLE PRIMAIRE PUBLIQUE MARIN MARIE";"CAROLLES";"NORMANDIE";"Rural à habitat dispersé";"PUBLIC";0;2;32
"20689";"0501859Z";"ECOLE PRIMAIRE PUBLIQUE FRANCOIS-HYPOLITE GARNIER";"LINGREVILLE";"NORMANDIE";"Rural à habitat dispersé";"PUBLIC";0;4;77
"20722";"0510258D";"ECOLE MATERNELLE PUBLIQUE RENE CHAZOT";"BAZANCOURT";"REIMS";"Petites villes";"PUBLIC";0;4;110
"20751";"0510405N";"ECOLE PRIMAIRE PUBLIQUE -";"SAINT-HILAIRE-LE-GRAND";"REIMS";"Rural à habitat dispersé";"PUBLIC";0;4;90
"20837";"0510727N";"ECOLE PRIMAIRE PUBLIQUE BEAUTEMPS BEAUPRE";"LA NEUVILLE-AU-PONT";"REIMS";"Rural à habitat dispersé";"PUBLIC";0;3;48
"20956";"0511403Y";"ECOLE MATERNELLE PUBLIQUE PAULINE KERGOMARD";"SAINT-BRICE-COURCELLES";"REIMS";"Grands centres urbains";"PUBLIC";0;5;115
"20971";"0511454D";"ECOLE ELEMENTAIRE PUBLIQUE -";"DAMERY";"REIMS";"Bourgs ruraux";"PUBLIC";0;4;93
"20975";"0511461L";"ECOLE ELEMENTAIRE PUBLIQUE PIERRE DUPRE";"AY-CHAMPAGNE";"REIMS";"Bourgs ruraux";"PUBLIC";0;3;67
"20995";"0511520A";"ECOLE ELEMENTAIRE PUBLIQUE -";"PIERRY";"REIMS";"Ceintures urbaines";"PUBLIC";0;4;80
"21013";"0511594F";"ECOLE PRIMAIRE -";"CHATILLON-SUR-MARNE";"REIMS";"Rural à habitat dispersé";"PUBLIC";0;4;75
"21057";"0511798C";"ECOLE ELEMENTAIRE PUBLIQUE MAZARIN";"REIMS";"REIMS";"Grands centres urbains";"PUBLIC";0;6;134
"21109";"0512149J";"ECOLE PRIMAIRE PUBLIQUE CORMICY";"CORMICY";"REIMS";"Bourgs ruraux";"PUBLIC";0;8;166
"21137";"0520280X";"ECOLE PRIMAIRE PUBLIQUE LANEUVILLE-A-BAYARD";"BAYARD-SUR-MARNE";"REIMS";"Rural à habitat dispersé";"PUBLIC";0;5;110
"21172";"0520591K";"ECOLE ELEMENTAIRE PUBLIQUE RENE CASSIN";"CHAUMONT";"REIMS";"Centres urbains intermédiaires";"PUBLIC";1;9;153
"21183";"0520638L";"ECOLE PRIMAIRE PUBLIQUE LONGEVILLE SUR LA LAINES";"RIVES DERVOISES";"REIMS";"Rural à habitat dispersé";"PUBLIC";0;2;38
"21279";"0530105B";"ECOLE PRIMAIRE PUBLIQUE GROUPE SCOLAIRE";"BAIS";"NANTES";"Rural à habitat dispersé";"PUBLIC";0;4;82
"21286";"0530119S";"ECOLE PRIMAIRE PUBLIQUE -";"BELGEARD";"NANTES";"Rural à habitat dispersé";"PUBLIC";0;3;62
"21296";"0530141R";"ECOLE PRIMAIRE PUBLIQUE -";"CHAILLAND";"NANTES";"Rural à habitat dispersé";"PUBLIC";0;2;46
"21302";"0530162N";"ECOLE PRIMAIRE PUBLIQUE ECOLE DU BOUT DU MONDE";"CHATEAU-GONTIER-SUR-MAYENNE";"NANTES";"Centres urbains intermédiaires";"PUBLIC";0;4;88
"21314";"0530188S";"ECOLE PRIMAIRE PUBLIQUE G. S CONSTANCE LAINE";"CRAON";"NANTES";"Bourgs ruraux";"PUBLIC";0;11;237
"21386";"0530388J";"ECOLE ELEMENTAIRE PUBLIQUE R.P.I.D BOUERE";"SAINT-BRICE";"NANTES";"Rural à habitat dispersé";"PUBLIC";0;2;46
"21400";"0530418S";"ECOLE PRIMAIRE PUBLIQUE -";"BLANDOUET-SAINT JEAN";"NANTES";"Rural à habitat très dispersé";"PUBLIC";0;1;20
"21424";"0530504K";"ECOLE ELEMENTAIRE PUBLIQUE -";"GORRON";"NANTES";"Bourgs ruraux";"PUBLIC";0;6;118
"21505";"0530707F";"ECOLE PRIMAIRE PRIVEE NAZARETH";"BONCHAMP-LES-LAVAL";"NANTES";"Ceintures urbaines";"PRIVE";0;9;203
"21547";"0530795B";"ECOLE PRIMAIRE PRIVEE STE MARIE";"MERAL";"NANTES";"Bourgs ruraux";"PRIVE";0;5;96
"21672";"0540620F";"ECOLE MATERNELLE PUBLIQUE EMILE ZOLA";"LAXOU";"NANCY-METZ";"Grands centres urbains";"PUBLIC";0;4;82
"21715";"0540797Y";"ECOLE ELEMENTAIRE PUBLIQUE DANIELLE CASANOVA";"MOUTIERS";"NANCY-METZ";"Petites villes";"PUBLIC";0;4;82
"21786";"0541038K";"ECOLE PRIMAIRE PUBLIQUE -";"TELLANCOURT";"NANCY-METZ";"Rural à habitat dispersé";"PUBLIC";0;4;89
"21859";"0541584D";"ECOLE ELEMENTAIRE PUBLIQUE JULES FERRY";"DOMMARTIN-LES-TOUL";"NANCY-METZ";"Ceintures urbaines";"PUBLIC";0;7;140
"21864";"0541599V";"ECOLE MATERNELLE PUBLIQUE LANGEVIN WALLON";"JARNY";"NANCY-METZ";"Petites villes";"PUBLIC";0;3;61
"21877";"0541644U";"ECOLE PRIMAIRE PRIVEE SAINT LEON IX";"NANCY";"NANCY-METZ";"Grands centres urbains";"PRIVE";0;14;361
"21998";"0542003J";"ECOLE ELEMENTAIRE PUBLIQUE JEUYETE";"POMPEY";"NANCY-METZ";"Centres urbains intermédiaires";"PUBLIC";0;5;96
"22103";"0542345F";"ECOLE ELEMENTAIRE PUBLIQUE ROMAIN ROLLAND";"AUBOUE";"NANCY-METZ";"Petites villes";"PUBLIC";1;10;151
"22110";"0542549C";"ECOLE PRIMAIRE PUBLIQUE JOB DURUPT";"TOMBLAINE";"NANCY-METZ";"Grands centres urbains";"PUBLIC";0;5;124
"22197";"0550809F";"ECOLE ELEMENTAIRE PUBLIQUE PIERRE ROBIN";"ROBERT-ESPAGNE";"NANCY-METZ";"Bourgs ruraux";"PUBLIC";0;4;63
"22320";"0560371Z";"ECOLE MATERNELLE PUBLIQUE ARC EN CIEL";"PLOUAY";"RENNES";"Bourgs ruraux";"PUBLIC";0;5;103
"22324";"0560389U";"ECOLE PRIMAIRE PUBLIQUE LE MENEZ";"LARMOR-PLAGE";"RENNES";"Ceintures urbaines";"PUBLIC";0;13;324
"22345";"0560453N";"ECOLE PRIMAIRE FRANCAISE DES NEUF ECLUSES";"SAINT-GERAND";"RENNES";"Rural à habitat dispersé";"PUBLIC";0;3;63
"22360";"0560496K";"ECOLE PRIMAIRE PUBLIQUE MARIE CURIE";"THEIX-NOYALO";"RENNES";"Bourgs ruraux";"PUBLIC";0;14;300
"22375";"0560559D";"ECOLE PRIMAIRE PUBLIQUE DE L'EVEL";"GUENIN";"RENNES";"Rural à habitat dispersé";"PUBLIC";0;2;43
"22419";"0560729N";"ECOLE PRIMAIRE PUBLIQUE JULES FERRY";"QUIBERON";"RENNES";"Petites villes";"PUBLIC";0;7;161
"22447";"0560873V";"ECOLE PRIMAIRE PRIVEE STE MARIE";"ARRADON";"RENNES";"Bourgs ruraux";"PRIVE";0;7;182
"22510";"0561003L";"ECOLE PRIMAIRE PRIVEE ST GILLES";"HENNEBONT";"RENNES";"Petites villes";"PRIVE";0;9;227
"22622";"0561245Z";"ECOLE PRIMAIRE PRIVEE ST JOSEPH";"SAINT-JEAN-LA-POTERIE";"RENNES";"Bourgs ruraux";"PRIVE";0;3;65
"22660";"0561304N";"ECOLE PRIMAIRE PRIVEE STE THERESE";"LA VRAIE-CROIX";"RENNES";"Bourgs ruraux";"PRIVE";0;3;67
"22707";"0561520Y";"ECOLE PRIMAIRE PUBLIQUE XAVIER GRALL";"PLUMERGAT";"RENNES";"Bourgs ruraux";"PUBLIC";0;6;139
"22805";"0570407H";"ECOLE ELEMENTAIRE PUBLIQUE -";"OBERDORFF";"NANCY-METZ";"Rural à habitat dispersé";"PUBLIC";0;1;19
"22938";"0570960J";"ECOLE MATERNELLE PUBLIQUE REPUBLIQUE";"MOYEUVRE-GRANDE";"NANCY-METZ";"Ceintures urbaines";"PUBLIC";1;2;36
"23088";"0571953N";"ECOLE ELEMENTAIRE PUBLIQUE THOMAS PESQUET";"JURY";"NANCY-METZ";"Rural à habitat dispersé";"PUBLIC";0;3;58
"23135";"0572155H";"ECOLE MATERNELLE PUBLIQUE VILLE BASSE CHANTECLAIR";"ROMBAS";"NANCY-METZ";"Centres urbains intermédiaires";"PUBLIC";0;2;60
"23151";"0572245F";"ECOLE PRIMAIRE PUBLIQUE -";"REMERING-LES-PUTTELANGE";"NANCY-METZ";"Rural à habitat dispersé";"PUBLIC";0;4;79
"23224";"0572528N";"ECOLE MATERNELLE PUBLIQUE BORNY GR3 LES MIRABELLES";"METZ";"NANCY-METZ";"Grands centres urbains";"PUBLIC";1;10;188
"23249";"0572611D";"ECOLE MATERNELLE PUBLIQUE INTERCOMMUNALE";"HERNY";"NANCY-METZ";"Rural à habitat dispersé";"PUBLIC";0;2;47
"23372";"0573034N";"ECOLE MATERNELLE PUBLIQUE -";"BUDING";"NANCY-METZ";"Bourgs ruraux";"PUBLIC";0;1;23
"23373";"0573036R";"ECOLE MATERNELLE PUBLIQUE EBERSBORN";"VALMONT";"NANCY-METZ";"Ceintures urbaines";"PUBLIC";0;2;45
"23431";"0573193L";"ECOLE MATERNELLE PUBLIQUE DES TILLEULS";"VAUX";"NANCY-METZ";"Ceintures urbaines";"PUBLIC";0;1;26
"23473";"0573298A";"ECOLE ELEMENTAIRE PUBLIQUE PASTEUR";"YUTZ";"NANCY-METZ";"Centres urbains intermédiaires";"PUBLIC";0;9;197
"23475";"0573311P";"ECOLE PRIMAIRE BRIEUX";"MAIZIERES-LES-METZ";"NANCY-METZ";"Centres urbains intermédiaires";"PUBLIC";0;12;267
"23490";"0573342Y";"ECOLE MATERNELLE PUBLIQUE -";"HAUT-CLOCHER";"NANCY-METZ";"Rural à habitat dispersé";"PUBLIC";0;1;34
"23502";"0573362V";"ECOLE ELEMENTAIRE PUBLIQUE MICHEL COLUCCI";"METZ";"NANCY-METZ";"Grands centres urbains";"PUBLIC";1;12;203
"23506";"0573368B";"ECOLE ELEMENTAIRE PUBLIQUE L. PASTEUR";"REDING";"NANCY-METZ";"Ceintures urbaines";"PUBLIC";0;5;99
"23510";"0573376K";"ECOLE ELEMENTAIRE PUBLIQUE BAS-STEINBESCH";"FAULQUEMONT";"NANCY-METZ";"Petites villes";"PUBLIC";0;5;104
"23512";"0573378M";"ECOLE PRIMAIRE B. RABAS";"SCY-CHAZELLES";"NANCY-METZ";"Ceintures urbaines";"PUBLIC";0;10;220
"23515";"0573384U";"ECOLE PRIMAIRE G. CHARPENTIER";"DIEUZE";"NANCY-METZ";"Bourgs ruraux";"PUBLIC";0;13;248
"23529";"0573417E";"ECOLE PRIMAIRE STE SEGOLENE DEBUSSY";"METZ";"NANCY-METZ";"Grands centres urbains";"PUBLIC";0;11;244
"23532";"0573422K";"ECOLE ELEMENTAIRE PUBLIQUE GREGOIRE SOLOTAREFF";"KUNTZIG";"NANCY-METZ";"Bourgs ruraux";"PUBLIC";0;4;83
"23533";"0573423L";"ECOLE ELEMENTAIRE PUBLIQUE SAINTE BARBE";"ENTRANGE";"NANCY-METZ";"Bourgs ruraux";"PUBLIC";0;3;70
"23616";"0573626G";"ECOLE PRIMAIRE R. SCHUMAN";"SARRALBE";"NANCY-METZ";"Bourgs ruraux";"PUBLIC";0;15;309
"23637";"0573691C";"ECOLE PRIMAIRE PUBLIQUE CENTRE";"CREUTZWALD";"NANCY-METZ";"Ceintures urbaines";"PUBLIC";0;10;218
"23641";"0573697J";"ECOLE PRIMAIRE PUBLIQUE VIEUX STIRING BICULTURELLE";"STIRING-WENDEL";"NANCY-METZ";"Centres urbains intermédiaires";"PUBLIC";1;9;164
"23731";"0580374S";"ECOLE MATERNELLE PUBLIQUE LES ALLEES";"GUERIGNY";"DIJON";"Bourgs ruraux";"PUBLIC";0;5;105
"23755";"0580431D";"ECOLE ELEMENTAIRE PUBLIQUE -";"LURCY-LE-BOURG";"DIJON";"Rural à habitat très dispersé";"PUBLIC";0;1;16
"23809";"0580644K";"ECOLE PRIMAIRE PUBLIQUE -";"CERVON";"DIJON";"Rural à habitat dispersé";"PUBLIC";1;2;19
"23859";"0590313V";"ECOLE ELEMENTAIRE PUBLIQUE ANDRE DUCARNE";"BOUSIES";"LILLE";"Bourgs ruraux";"PUBLIC";0;5;102
"23865";"0590321D";"ECOLE ELEMENTAIRE PUBLIQUE CLAUDE BOUQUIAUX RPI 8";"ELESMES";"LILLE";"Rural à habitat dispersé";"PUBLIC";0;3;60
"23918";"0590509H";"ECOLE ELEMENTAIRE PUBLIQUE ANATOLE FRANCE";"ARMENTIERES";"LILLE";"Centres urbains intermédiaires";"PUBLIC";0;8;178
"24017";"0590817T";"ECOLE MATERNELLE PUBLIQUE FRANCOISE DOLTO";"CAUDRY";"LILLE";"Centres urbains intermédiaires";"PUBLIC";0;7;151
"24027";"0590834L";"ECOLE PRIMAIRE PUBLIQUE -";"CHEMY";"LILLE";"Ceintures urbaines";"PUBLIC";0;3;63
"24109";"0591062J";"ECOLE PRIMAIRE PUBLIQUE LOUISE THULIEZ";"PREUX-AU-BOIS";"LILLE";"Rural à habitat dispersé";"PUBLIC";0;3;70
"24134";"0591154J";"ECOLE MATERNELLE PUBLIQUE ANNE FRANK";"FEIGNIES";"LILLE";"Ceintures urbaines";"PUBLIC";1;2;27
"24142";"0591197F";"ECOLE PRIMAIRE PUBLIQUE LE CENTRE";"FLOYON";"LILLE";"Rural à habitat très dispersé";"PUBLIC";0;3;52
"24293";"0591622T";"ECOLE MATERNELLE PUBLIQUE AUGUSTE COMTE";"LILLE";"LILLE";"Grands centres urbains";"PUBLIC";0;3;47
"24384";"0591915L";"ECOLE PRIMAIRE PUBLIQUE LA CLAIRIERE";"LA NEUVILLE";"LILLE";"Ceintures urbaines";"PUBLIC";0;3;66
"24420";"0591999C";"ECOLE PRIMAIRE PUBLIQUE -";"RAMILLIES";"LILLE";"Ceintures urbaines";"PUBLIC";0;2;40
"24462";"0592089A";"ECOLE PRIMAIRE PIERRE DE RONSARD NIVEAU 1";"ROUBAIX";"LILLE";"Grands centres urbains";"PUBLIC";1;7;92
"24466";"0592100M";"ECOLE MATERNELLE PUBLIQUE EDOUARD VAILLANT";"ROUBAIX";"LILLE";"Grands centres urbains";"PUBLIC";0;4;90
"24486";"0592143J";"ECOLE PRIMAIRE PUBLIQUE LEON DORLEANT";"SAINS-DU-NORD";"LILLE";"Bourgs ruraux";"PUBLIC";0;7;137
"24515";"0592218R";"ECOLE PRIMAIRE PUBLIQUE -";"SARS-ET-ROSIERES";"LILLE";"Bourgs ruraux";"PUBLIC";0;5;113
"24528";"0592261M";"ECOLE MATERNELLE PUBLIQUE JEAN ZAY MARIE CURIE";"SOLESMES";"LILLE";"Bourgs ruraux";"PUBLIC";0;5;102
"24576";"0592370F";"ECOLE PRIMAIRE PUBLIQUE PASTEUR";"TOURCOING";"LILLE";"Grands centres urbains";"PUBLIC";1;10;165
"24580";"0592377N";"ECOLE PRIMAIRE PUBLIQUE JEAN DE LA FONTAINE";"TOURMIGNIES";"LILLE";"Petites villes";"PUBLIC";0;4;89
"24601";"0592436C";"ECOLE PRIMAIRE PUBLIQUE GUTENBERG";"VERLINGHEM";"LILLE";"Ceintures urbaines";"PUBLIC";0;6;141
"24672";"0592672J";"ECOLE ELEMENTAIRE PUBLIQUE PIERRE LOTI";"LAMBERSART";"LILLE";"Grands centres urbains";"PUBLIC";0;4;96
"24710";"0593258W";"ECOLE MATERNELLE PUBLIQUE MARTIN-MARTINE";"CAMBRAI";"LILLE";"Centres urbains intermédiaires";"PUBLIC";0;2;46
"24820";"0593724C";"ECOLE PRIMAIRE PRIVEE SAINT JOSEPH";"CYSOING";"LILLE";"Ceintures urbaines";"PRIVE";0;8;204
"24938";"0594023C";"ECOLE PRIMAIRE PRIVEE SACRE COEUR";"GRAVELINES";"LILLE";"Petites villes";"PRIVE";0;8;190
"24968";"0594081R";"ECOLE PRIMAIRE PRIVEE SAINT JOSEPH";"SAINGHIN-EN-MELANTOIS";"LILLE";"Ceintures urbaines";"PRIVE";0;8;216
"24971";"0594087X";"ECOLE PRIMAIRE PRIVEE NOTRE DAME DU PERPETUEL SECOURS-STE THERESE";"SANTES";"LILLE";"Ceintures urbaines";"PRIVE";0;9;255
"24984";"0594120H";"ECOLE PRIMAIRE PRIVEE NOTRE DAME";"VALENCIENNES";"LILLE";"Grands centres urbains";"PRIVE";0;17;469
"25114";"0594463F";"ECOLE ELEMENTAIRE PUBLIQUE DU CENTRE";"ANOR";"LILLE";"Rural à habitat dispersé";"PUBLIC";1;8;117
"25128";"0594480Z";"ECOLE PRIMAIRE PUBLIQUE LUCIE AUBRAC";"MOUVAUX";"LILLE";"Grands centres urbains";"PUBLIC";0;9;222
"25204";"0594703S";"ECOLE ELEMENTAIRE PUBLIQUE DERAIN - BETTIGNIES";"MARCQ-EN-BAROEUL";"LILLE";"Grands centres urbains";"PUBLIC";0;8;188
"25236";"0594851C";"ECOLE ELEMENTAIRE PUBLIQUE LANGEVIN";"DUNKERQUE";"LILLE";"Grands centres urbains";"PUBLIC";1;7;100
"25240";"0594903J";"ECOLE ELEMENTAIRE PUBLIQUE MARIUS ASSEZ";"ABSCON";"LILLE";"Ceintures urbaines";"PUBLIC";1;11;177
"25402";"0595373V";"ECOLE PRIMAIRE PUBLIQUE PAUL VERLAINE";"VILLENEUVE-D'ASCQ";"LILLE";"Grands centres urbains";"PUBLIC";0;11;242
"25418";"0595502K";"ECOLE ELEMENTAIRE PUBLIQUE CELESTIN FREINET";"GRANDE-SYNTHE";"LILLE";"Grands centres urbains";"PUBLIC";0;6;117
"25424";"0595511V";"ECOLE MATERNELLE PUBLIQUE LA BRIQUETERIE";"LILLE";"LILLE";"Grands centres urbains";"PUBLIC";1;4;57
"25434";"0595606Y";"ECOLE PRIMAIRE PUBLIQUE DECOSTER - THYL L'ESPIEGLE";"BAILLEUL";"LILLE";"Centres urbains intermédiaires";"PUBLIC";0;5;112
"25441";"0595670T";"ECOLE MATERNELLE PUBLIQUE SAINT EXUPERY";"PETITE-FORET";"LILLE";"Grands centres urbains";"PUBLIC";0;6;129
"25461";"0595925V";"ECOLE PRIMAIRE PUBLIQUE JULES FERRY";"AULNOY-LEZ-VALENCIENNES";"LILLE";"Grands centres urbains";"PUBLIC";0;13;317
"25467";"0595932C";"ECOLE PRIMAIRE PUBLIQUE LE PETIT PRINCE";"GENECH";"LILLE";"Bourgs ruraux";"PUBLIC";0;8;182
"25474";"0595943P";"ECOLE PRIMAIRE PUBLIQUE VOLTAIRE";"WATTRELOS";"LILLE";"Grands centres urbains";"PUBLIC";1;8;146
"25556";"0596464F";"ECOLE PRIMAIRE PUBLIQUE TILL L'ESPIEGLE";"CASSEL";"LILLE";"Rural à habitat dispersé";"PUBLIC";0;6;111
"25611";"0596633P";"ECOLE PRIMAIRE PUBLIQUE LES BEAUX MONTS";"SAINT-SAULVE";"LILLE";"Grands centres urbains";"PUBLIC";0;9;190
"25682";"0600144F";"ECOLE ELEMENTAIRE PUBLIQUE -";"LIERVILLE";"AMIENS";"Rural à habitat dispersé";"PUBLIC";0;2;53
"25728";"0600237G";"ECOLE ELEMENTAIRE PUBLIQUE -";"LACHAPELLE-AUX-POTS";"AMIENS";"#N/A";"PUBLIC";0;1;23
"25742";"0600263K";"ECOLE ELEMENTAIRE PUBLIQUE YVES DUTEIL";"SAINT-PIERRE-LES-BITRY";"AMIENS";"Rural à habitat dispersé";"PUBLIC";0;1;14
"25798";"0600378K";"ECOLE ELEMENTAIRE PUBLIQUE -";"DAMERAUCOURT";"AMIENS";"Rural à habitat dispersé";"PUBLIC";0;1;21
"25861";"0600476S";"ECOLE MATERNELLE PUBLIQUE ROYALLIEU";"COMPIEGNE";"AMIENS";"Centres urbains intermédiaires";"PUBLIC";1;5;65
"25880";"0600497P";"ECOLE MATERNELLE PUBLIQUE CONSTANT BOUDOUX";"VILLERS-SAINT-PAUL";"AMIENS";"Grands centres urbains";"PUBLIC";1;4;73
"25932";"0600577B";"ECOLE PRIMAIRE PUBLIQUE -";"MONCEAUX";"AMIENS";"Ceintures urbaines";"PUBLIC";0;5;117
"26015";"0600772N";"ECOLE PRIMAIRE LOUISE MICHEL";"SAINT-VAAST-LES-MELLO";"AMIENS";"Ceintures urbaines";"PUBLIC";0;4;85
"26052";"0600854C";"ECOLE ELEMENTAIRE PUBLIQUE -";"HARDIVILLERS";"AMIENS";"Rural à habitat dispersé";"PUBLIC";0;2;42
"26056";"0600862L";"ECOLE PRIMAIRE PUBLIQUE -";"PUITS-LA-VALLEE";"AMIENS";"Rural à habitat dispersé";"PUBLIC";0;1;17
"26100";"0600937T";"ECOLE ELEMENTAIRE PUBLIQUE -";"GOURNAY-SUR-ARONDE";"AMIENS";"Bourgs ruraux";"PUBLIC";0;2;46
"26133";"0601003P";"ECOLE ELEMENTAIRE PUBLIQUE -";"VERSIGNY";"AMIENS";"Rural à habitat dispersé";"PUBLIC";0;2;35
"26145";"0601024M";"ECOLE ELEMENTAIRE PUBLIQUE -";"MORLINCOURT";"AMIENS";"Rural à habitat dispersé";"PUBLIC";0;2;40
"26202";"0601116M";"ECOLE PRIMAIRE PUBLIQUE DE LA NONETTE";"AVILLY-SAINT-LEONARD";"AMIENS";"Ceintures urbaines";"PUBLIC";0;5;118
"26277";"0601430D";"ECOLE MATERNELLE PUBLIQUE GUYNEMER";"ESTREES-SAINT-DENIS";"AMIENS";"Bourgs ruraux";"PUBLIC";0;2;43
"26293";"0601468V";"ECOLE PRIMAIRE PRIVEE NOTRE DAME DE LA PROVIDENCE";"CLERMONT";"AMIENS";"Centres urbains intermédiaires";"PRIVE";0;17;429
"26305";"0601496A";"ECOLE PRIMAIRE ROSTAND - LHERMITE";"PONTPOINT";"AMIENS";"Ceintures urbaines";"PUBLIC";0;6;126
"26340";"0601638E";"ECOLE MATERNELLE PUBLIQUE ST EXUPERY";"LAMORLAYE";"AMIENS";"Ceintures urbaines";"PUBLIC";0;3;79
"26342";"0601640G";"ECOLE MATERNELLE PUBLIQUE GEORGES POMPIDOU 2";"COMPIEGNE";"AMIENS";"Centres urbains intermédiaires";"PUBLIC";1;4;60
"26346";"0601647P";"ECOLE MATERNELLE PUBLIQUE DE L'ARONDE";"CLAIROIX";"AMIENS";"Ceintures urbaines";"PUBLIC";0;3;60
"26364";"0601693P";"ECOLE PRIMAIRE PUBLIQUE HENRI DUBREUIL";"BERTHECOURT";"AMIENS";"Bourgs ruraux";"PUBLIC";0;7;161
"26371";"0601725Z";"ECOLE ELEMENTAIRE PUBLIQUE DU MOULIN";"TRACY-LE-VAL";"AMIENS";"Bourgs ruraux";"PUBLIC";0;2;41
"26377";"0601739P";"ECOLE ELEMENTAIRE PUBLIQUE GEORGES POMPIDOU GROUPE B";"COMPIEGNE";"AMIENS";"Centres urbains intermédiaires";"PUBLIC";1;9;127
"26452";"0602009H";"ECOLE PRIMAIRE PUBLIQUE -";"BAILLEUL-SUR-THERAIN";"AMIENS";"Bourgs ruraux";"PUBLIC";0;11;242
"26479";"0610078D";"ECOLE MATERNELLE PUBLIQUE ROLAND";"FLERS";"NORMANDIE";"Centres urbains intermédiaires";"PUBLIC";0;3;63
"26805";"0620540A";"ECOLE ELEMENTAIRE PUBLIQUE RPI 13";"BARASTRE";"LILLE";"Rural à habitat dispersé";"PUBLIC";0;1;23
"26930";"0620898P";"ECOLE MATERNELLE PUBLIQUE RPI DES DEUX MONTS (RPI 153)";"SAINT-MARTIN-CHOQUEL";"LILLE";"Rural à habitat dispersé";"PUBLIC";0;1;21
"26951";"0620972V";"ECOLE ELEMENTAIRE PUBLIQUE MARYSE BASTIE";"BARLIN";"LILLE";"Ceintures urbaines";"PUBLIC";0;3;54
"26974";"0621052G";"ECOLE PRIMAIRE CONDE";"CALAIS";"LILLE";"Grands centres urbains";"PUBLIC";1;13;168
"27052";"0621263L";"ECOLE ELEMENTAIRE PUBLIQUE GR SCOL FERRY-HUGO";"SAINT-ETIENNE-AU-MONT";"LILLE";"Ceintures urbaines";"PUBLIC";0;9;163
"27112";"0621517M";"ECOLE PRIMAIRE PUBLIQUE LE FRENELET";"LORGIES";"LILLE";"Rural à habitat dispersé";"PUBLIC";0;6;121
"27142";"0621611P";"ECOLE MATERNELLE PUBLIQUE RPI 44";"SEMPY";"LILLE";"Rural à habitat dispersé";"PUBLIC";0;2;41
"27153";"0621639V";"ECOLE PRIMAIRE PUBLIQUE ANTOINE DE ST EXUPERY";"LE TOUQUET-PARIS-PLAGE";"LILLE";"Ceintures urbaines";"PUBLIC";0;10;210
"27160";"0621662V";"ECOLE ELEMENTAIRE PUBLIQUE VICTOR HUGO";"MONTREUIL";"LILLE";"Bourgs ruraux";"PUBLIC";0;9;174
"27165";"0621674H";"ECOLE PRIMAIRE PUBLIQUE JEAN MOULIN";"WAILLY-BEAUCAMP";"LILLE";"Rural à habitat dispersé";"PUBLIC";0;5;120
"27232";"0621873Z";"ECOLE PRIMAIRE PUBLIQUE -";"SETQUES";"LILLE";"Ceintures urbaines";"PUBLIC";0;3;51
"27348";"0622446X";"ECOLE PRIMAIRE PUBLIQUE THOMAS PESQUET";"ARRAS";"LILLE";"Grands centres urbains";"PUBLIC";0;4;75
"27350";"0622448Z";"ECOLE ELEMENTAIRE PUBLIQUE HENRI WALLON";"AVION";"LILLE";"Grands centres urbains";"PUBLIC";1;7;97
"27387";"0622612C";"ECOLE PRIMAIRE PRIVEE SAINTE-FAMILLE";"BETHUNE";"LILLE";"Centres urbains intermédiaires";"PRIVE";0;15;401
"27462";"0622748A";"ECOLE PRIMAIRE PRIVEE SAINTE-FLORINE";"DOUVRIN";"LILLE";"Centres urbains intermédiaires";"PRIVE";0;8;202
"27620";"0623166E";"ECOLE MATERNELLE PUBLIQUE MARCEL CATHELAIN";"NOYELLES-GODAULT";"LILLE";"Centres urbains intermédiaires";"PUBLIC";0;5;99
"27650";"0623308J";"ECOLE ELEMENTAIRE PUBLIQUE SIMONE VEIL";"MERLIMONT";"LILLE";"Ceintures urbaines";"PUBLIC";0;6;125
"27700";"0623443F";"ECOLE PRIMAIRE PUBLIQUE JEAN JAURES";"LIBERCOURT";"LILLE";"Centres urbains intermédiaires";"PUBLIC";1;8;153
"27743";"0623524U";"ECOLE ELEMENTAIRE PUBLIQUE JULES FERRY";"DOURGES";"LILLE";"Ceintures urbaines";"PUBLIC";0;11;211
"27825";"0623868T";"ECOLE ELEMENTAIRE PUBLIQUE ANNE FRANK";"AUCHY-LES-MINES";"LILLE";"Ceintures urbaines";"PUBLIC";1;7;94
"27881";"0624113J";"ECOLE PRIMAIRE PUBLIQUE BUCAILLE-PELLETAN";"BOULOGNE-SUR-MER";"LILLE";"Grands centres urbains";"PUBLIC";1;15;234
"28044";"0630396N";"ECOLE PRIMAIRE PUBLIQUE -";"DORANGES";"CLERMONT-FERRAND";"Rural à habitat très dispersé";"PUBLIC";0;1;13
"28051";"0630414H";"ECOLE PRIMAIRE -";"ESCOUTOUX";"CLERMONT-FERRAND";"Rural à habitat dispersé";"PUBLIC";0;5;99
"28088";"0630510M";"ECOLE ELEMENTAIRE PUBLIQUE FERNAND TOURDIAS";"LES MARTRES-D'ARTIERE";"CLERMONT-FERRAND";"Bourgs ruraux";"PUBLIC";0;5;124
"28158";"0630775A";"ECOLE PRIMAIRE -";"SAINT-MAURICE";"CLERMONT-FERRAND";"Rural à habitat dispersé";"PUBLIC";0;4;91
"28159";"0630777C";"ECOLE ELEMENTAIRE PUBLIQUE -";"SAINT-NECTAIRE";"CLERMONT-FERRAND";"Rural à habitat dispersé";"PUBLIC";0;2;39
"28163";"0630794W";"ECOLE ELEMENTAIRE PUBLIQUE -";"SAINT-QUINTIN-SUR-SIOULE";"CLERMONT-FERRAND";"Rural à habitat très dispersé";"PUBLIC";0;1;23
"28171";"0630821A";"ECOLE PRIMAIRE -";"SAURIER";"CLERMONT-FERRAND";"Rural à habitat dispersé";"PUBLIC";0;2;21
"28192";"0630881R";"ECOLE ELEMENTAIRE PUBLIQUE -";"VERNINES";"CLERMONT-FERRAND";"Rural à habitat dispersé";"PUBLIC";0;2;40
"28246";"0631024W";"ECOLE ELEMENTAIRE PUBLIQUE BEAUDONNAT";"AUBIERE";"CLERMONT-FERRAND";"Grands centres urbains";"PUBLIC";0;8;198
"28301";"0631349Z";"ECOLE ELEMENTAIRE PRIVEE SAINT JOSEPH";"PONT-DU-CHATEAU";"CLERMONT-FERRAND";"Centres urbains intermédiaires";"PRIVE";0;12;313
