"";"code_ecole";"nom_ecole";"commune";"academie";"densite";"secteur";"rep";"classes";"eleves"
"9353";"0270596B";"ECOLE ELEMENTAIRE PUBLIQUE -";"LE THIL";"NORMANDIE";"Rural à habitat dispersé";"PUBLIC";0;2;54
"9368";"0270639Y";"ECOLE PRIMAIRE -";"MARTOT";"NORMANDIE";"Rural à habitat dispersé";"PUBLIC";0;2;31
"9400";"0270795T";"ECOLE PRIMAIRE ROBERT LEBLANC";"SAINT-ETIENNE-L'ALLIER";"NORMANDIE";"Rural à habitat dispersé";"PUBLIC";0;2;45
"9454";"0270980U";"ECOLE PRIMAIRE PUBLIQUE VENABLES";"LES TROIS LACS";"NORMANDIE";"Rural à habitat dispersé";"PUBLIC";0;2;34
"9531";"0271265D";"ECOLE PRIMAIRE LA MARE AUTOUR";"BOISSY-LAMBERVILLE";"NORMANDIE";"Rural à habitat très dispersé";"PUBLIC";0;6;139
"9550";"0271305X";"ECOLE PRIMAIRE PUBLIQUE -";"BOUQUETOT";"NORMANDIE";"Rural à habitat dispersé";"PUBLIC";0;5;109
"9580";"0271423A";"ECOLE MATERNELLE PUBLIQUE -";"GUICHAINVILLE";"NORMANDIE";"Bourgs ruraux";"PUBLIC";0;5;104
"9588";"0271440U";"ECOLE MATERNELLE PUBLIQUE ROBERT DESNOS";"EVREUX";"NORMANDIE";"Centres urbains intermédiaires";"PUBLIC";1;5;87
"9595";"0271472D";"ECOLE PRIMAIRE PUBLIQUE LES DOMINOS";"VAL-DE-REUIL";"NORMANDIE";"Centres urbains intermédiaires";"PUBLIC";1;17;262
"9718";"0280059M";"ECOLE MATERNELLE PUBLIQUE JEAN MACE - LA FONTAINE";"CHATEAUDUN";"ORLEANS-TOURS";"Petites villes";"PUBLIC";1;7;111
"9727";"0280075E";"ECOLE ELEMENTAIRE PUBLIQUE -";"CONIE-MOLITARD";"ORLEANS-TOURS";"Rural à habitat dispersé";"PUBLIC";0;1;21
"9729";"0280078H";"ECOLE PRIMAIRE PUBLIQUE JALLANS";"JALLANS";"ORLEANS-TOURS";"Rural à habitat dispersé";"PUBLIC";0;4;68
"9795";"0280249U";"ECOLE ELEMENTAIRE PUBLIQUE LA VALLEE";"CINTRAY";"ORLEANS-TOURS";"Bourgs ruraux";"PUBLIC";0;1;20
"9852";"0280398F";"ECOLE PRIMAIRE L'ECOLE DES BLES";"HOUVILLE-LA-BRANCHE";"ORLEANS-TOURS";"Rural à habitat dispersé";"PUBLIC";0;6;132
"10031";"0281063D";"ECOLE ELEMENTAIRE PUBLIQUE JULES VERNE";"BROU";"ORLEANS-TOURS";"Bourgs ruraux";"PUBLIC";0;6;109
"10034";"0281066G";"ECOLE PRIMAIRE LA VALLEE";"SAINT-REMY-SUR-AVRE";"ORLEANS-TOURS";"Petites villes";"PUBLIC";0;12;260
"10157";"0290759T";"ECOLE PRIMAIRE PUBLIQUE DU BOUT DU MONDE";"PLOGOFF";"RENNES";"Rural à habitat dispersé";"PUBLIC";0;3;59
"10163";"0290782T";"ECOLE PRIMAIRE PUBLIQUE INTERCOMMUNALE PIERRE JAKEZ HELIAS";"POULDREUZIC";"RENNES";"Rural à habitat dispersé";"PUBLIC";0;6;133
"10210";"0290911H";"ECOLE PRIMAIRE PUBLIQUE LEONTINE DRAPIER-CADEC";"IRVILLAC";"RENNES";"Bourgs ruraux";"PUBLIC";0;5;115
"10238";"0290995Z";"ECOLE PRIMAIRE PUBLIQUE DES SOURCES";"LE DRENNEC";"RENNES";"Bourgs ruraux";"PUBLIC";0;6;120
"10283";"0291176W";"ECOLE PRIMAIRE JEANNE MALIVEL";"PLOUZANE";"RENNES";"Ceintures urbaines";"PUBLIC";0;6;120
"10309";"0291242T";"ECOLE ELEMENTAIRE PRIVEE LA CROIX ROUGE";"BREST";"RENNES";"Grands centres urbains";"PRIVE";0;6;149
"10316";"0291256H";"ECOLE PRIMAIRE PRIVEE NOTRE DAME DE BON SECOURS";"LANDUNVEZ";"RENNES";"Rural à habitat dispersé";"PRIVE";0;3;38
"10370";"0291365B";"ECOLE PRIMAIRE PRIVEE NOTRE DAME DE KERNITRON";"LANMEUR";"RENNES";"Bourgs ruraux";"PRIVE";0;3;82
"10411";"0291437E";"ECOLE PRIMAIRE PRIVEE NOTRE DAME DU FOLGOET";"BANNALEC";"RENNES";"Rural à habitat dispersé";"PRIVE";0;5;101
"10496";"0291676P";"ECOLE ELEMENTAIRE PUBLIQUE DU BOURG";"ERGUE-GABERIC";"RENNES";"Bourgs ruraux";"PUBLIC";0;6;129
"10518";"0291719L";"ECOLE PRIMAIRE PUBLIQUE LUCIEN PRIGENT";"PLOUEGAT-MOYSAN";"RENNES";"Rural à habitat dispersé";"PUBLIC";0;4;84
"10520";"0291724S";"ECOLE MATERNELLE PUBLIQUE KERJEAN";"CHATEAULIN";"RENNES";"Bourgs ruraux";"PUBLIC";0;3;56
"10528";"0291734C";"ECOLE PRIMAIRE PUBLIQUE DU BOURG";"SAINT-THURIEN";"RENNES";"Rural à habitat dispersé";"PUBLIC";0;4;77
"10574";"0292019M";"ECOLE PRIMAIRE PUBLIQUE LE VIZAC";"SAINT-RENAN";"RENNES";"Petites villes";"PUBLIC";0;7;149
"10628";"0300160L";"ECOLE MATERNELLE PUBLIQUE MANDAJORS";"ALES";"MONTPELLIER";"Centres urbains intermédiaires";"PUBLIC";1;4;58
"10746";"0300487S";"ECOLE MATERNELLE PUBLIQUE LE PONTIL";"LAVAL-PRADEL";"MONTPELLIER";"Rural à habitat dispersé";"PUBLIC";0;2;33
"10816";"0300686H";"ECOLE ELEMENTAIRE PUBLIQUE -";"SAINT-BENEZET";"MONTPELLIER";"Rural à habitat dispersé";"PUBLIC";0;1;19
"10901";"0301001A";"ECOLE MATERNELLE PUBLIQUE MADELEINE BRES";"BOUILLARGUES";"MONTPELLIER";"Petites villes";"PUBLIC";0;6;153
"10918";"0301032J";"ECOLE ELEMENTAIRE PUBLIQUE -";"SAINT-CHAPTES";"MONTPELLIER";"Bourgs ruraux";"PUBLIC";0;5;123
"10971";"0301183Y";"ECOLE MATERNELLE PUBLIQUE JEAN CARRIERE";"NIMES";"MONTPELLIER";"Grands centres urbains";"PUBLIC";1;6;102
"11094";"0301488E";"ECOLE MATERNELLE PUBLIQUE -";"CRESPIAN";"MONTPELLIER";"Rural à habitat dispersé";"PUBLIC";0;3;67
"11136";"0301604F";"ECOLE ELEMENTAIRE PUBLIQUE ANDRE CHAMSON";"NIMES";"MONTPELLIER";"Grands centres urbains";"PUBLIC";1;12;195
"11153";"0301652H";"ECOLE PRIMAIRE PUBLIQUE -";"SAINT-JULIEN-DE-PEYROLAS";"MONTPELLIER";"Bourgs ruraux";"PUBLIC";0;8;159
"11176";"0301742F";"ECOLE PRIMAIRE PUBLIQUE TAMARIS";"ALES";"MONTPELLIER";"Centres urbains intermédiaires";"PUBLIC";1;9;146
"11272";"0310247A";"ECOLE MATERNELLE PUBLIQUE LA COLLINE AUX ENFANTS";"VILLEFRANCHE-DE-LAURAGAIS";"TOULOUSE";"Bourgs ruraux";"PUBLIC";0;6;147
"11304";"0310347J";"ECOLE ELEMENTAIRE PUBLIQUE -";"BOULOGNE-SUR-GESSE";"TOULOUSE";"Bourgs ruraux";"PUBLIC";0;5;83
"11356";"0310471U";"ECOLE ELEMENTAIRE PUBLIQUE -";"FLOURENS";"TOULOUSE";"Bourgs ruraux";"PUBLIC";0;6;133
"11481";"0310770U";"ECOLE ELEMENTAIRE PUBLIQUE JEAN MARIE FERIOL";"QUINT-FONSEGRIVES";"TOULOUSE";"Ceintures urbaines";"PUBLIC";0;14;353
"11483";"0310779D";"ECOLE PRIMAIRE PUBLIQUE -";"RENNEVILLE";"TOULOUSE";"Rural à habitat dispersé";"PUBLIC";0;3;65
"11538";"0310934X";"ECOLE ELEMENTAIRE PUBLIQUE MARENGO-PERIOLE";"TOULOUSE";"TOULOUSE";"Grands centres urbains";"PUBLIC";0;8;195
"11569";"0311067S";"ECOLE ELEMENTAIRE PUBLIQUE ANATOLE FRANCE";"VILLEMUR-SUR-TARN";"TOULOUSE";"Bourgs ruraux";"PUBLIC";0;7;165
"11617";"0311450H";"ECOLE PRIMAIRE PRIVEE SAINTE-MARTHE";"GRENADE";"TOULOUSE";"Centres urbains intermédiaires";"PRIVE";0;7;186
"11656";"0311559B";"ECOLE MATERNELLE PUBLIQUE -";"RIEUX-VOLVESTRE";"TOULOUSE";"Bourgs ruraux";"PUBLIC";0;4;96
"11717";"0311694Y";"ECOLE MATERNELLE PUBLIQUE LAMARTINE";"COLOMIERS";"TOULOUSE";"Grands centres urbains";"PUBLIC";0;5;122
"11732";"0311711S";"ECOLE PRIMAIRE PUBLIQUE BUISSONNIERE";"FONBEAUZARD";"TOULOUSE";"Grands centres urbains";"PUBLIC";0;15;337
"11775";"0311882C";"ECOLE MATERNELLE PUBLIQUE -";"ROQUETTES";"TOULOUSE";"Ceintures urbaines";"PUBLIC";0;5;131
"11872";"0312205D";"ECOLE MATERNELLE PUBLIQUE LES GAROSSES";"GRENADE";"TOULOUSE";"Centres urbains intermédiaires";"PUBLIC";0;2;54
"11922";"0312419L";"ECOLE PRIMAIRE PUBLIQUE MARIE-LOUISE DISSARD";"SAINT-JEAN";"TOULOUSE";"Grands centres urbains";"PUBLIC";0;17;387
"11930";"0312485H";"ECOLE PRIMAIRE PRIVEE ESCOLA CALANDRETA DE GARONETA";"TOULOUSE";"TOULOUSE";"Grands centres urbains";"PRIVE";0;5;110
"12011";"0312889X";"ECOLE PRIMAIRE PRIVEE CALANDRETA DE BOCONA";"PIBRAC";"TOULOUSE";"Ceintures urbaines";"PRIVE";0;1;26
"12132";"0320290S";"ECOLE ELEMENTAIRE PUBLIQUE -";"SEGOS";"TOULOUSE";"Rural à habitat dispersé";"PUBLIC";0;1;18
"12162";"0320385V";"ECOLE ELEMENTAIRE PUBLIQUE -";"ARBLADE-LE-HAUT";"TOULOUSE";"Rural à habitat très dispersé";"PUBLIC";0;2;42
"12225";"0320590T";"ECOLE PRIMAIRE PUBLIQUE -";"LA ROMIEU";"TOULOUSE";"Rural à habitat très dispersé";"PUBLIC";0;2;36
"12288";"0330254X";"ECOLE MATERNELLE PUBLIQUE PAIX";"BORDEAUX";"BORDEAUX";"Grands centres urbains";"PUBLIC";0;4;92
"12320";"0330298V";"ECOLE MATERNELLE PUBLIQUE JULES FERRY";"PESSAC";"BORDEAUX";"Grands centres urbains";"PUBLIC";0;5;119
"12329";"0330310H";"ECOLE MATERNELLE PUBLIQUE JOLIOT-CURIE";"TALENCE";"BORDEAUX";"Grands centres urbains";"PUBLIC";0;6;152
"12360";"0330394Z";"ECOLE PRIMAIRE PUBLIQUE PAUL LANGEVIN";"BEGLES";"BORDEAUX";"Grands centres urbains";"PUBLIC";0;12;275
"12409";"0330554Y";"ECOLE PRIMAIRE PUBLIQUE -";"CABARA";"BORDEAUX";"Rural à habitat dispersé";"PUBLIC";0;1;24
"12451";"0330690W";"ECOLE PRIMAIRE -";"FALEYRAS";"BORDEAUX";"Rural à habitat dispersé";"PUBLIC";0;1;23
"12503";"0330865L";"ECOLE PRIMAIRE PUBLIQUE ECOLE DE LOUCHATS";"LOUCHATS";"BORDEAUX";"Rural à habitat dispersé";"PUBLIC";0;3;53
"12537";"0330949C";"ECOLE PRIMAIRE PUBLIQUE -";"MOULON";"BORDEAUX";"Rural à habitat dispersé";"PUBLIC";0;5;109
"12551";"0330988V";"ECOLE PRIMAIRE PUBLIQUE EDOUARD HERRIOT";"PESSAC";"BORDEAUX";"Grands centres urbains";"PUBLIC";0;11;238
"12581";"0331081W";"ECOLE ELEMENTAIRE PUBLIQUE PIERRE DUFOUR";"SAINT-ANDRE-DE-CUBZAC";"BORDEAUX";"Centres urbains intermédiaires";"PUBLIC";0;13;276
"12685";"0331330S";"ECOLE PRIMAIRE PUBLIQUE DELTA";"LE TEICH";"BORDEAUX";"Ceintures urbaines";"PUBLIC";0;16;359
"12688";"0331340C";"ECOLE ELEMENTAIRE PUBLIQUE BREMONTIER";"LA TESTE-DE-BUCH";"BORDEAUX";"Centres urbains intermédiaires";"PUBLIC";0;10;240
"12691";"0331347K";"ECOLE MATERNELLE PUBLIQUE -";"TIZAC-DE-LAPOUYADE";"BORDEAUX";"Rural à habitat dispersé";"PUBLIC";0;2;45
"12695";"0331357W";"ECOLE ELEMENTAIRE PUBLIQUE EDOUARD DUBOIS";"VAYRES";"BORDEAUX";"Petites villes";"PUBLIC";0;13;313
"12724";"0331624L";"ECOLE MATERNELLE PUBLIQUE BOUSQUET";"BASSENS";"BORDEAUX";"Centres urbains intermédiaires";"PUBLIC";0;7;158
"12901";"0332160U";"ECOLE PRIMAIRE PUBLIQUE -";"VAL DE VIRVEE";"BORDEAUX";"Rural à habitat dispersé";"PUBLIC";0;8;196
"12904";"0332163X";"ECOLE ELEMENTAIRE PUBLIQUE ECOLE GILLES VERRAT";"ANGLADE";"BORDEAUX";"Rural à habitat dispersé";"PUBLIC";0;2;42
"12935";"0332210Y";"ECOLE ELEMENTAIRE PUBLIQUE JULES STEEG";"LIBOURNE";"BORDEAUX";"Centres urbains intermédiaires";"PUBLIC";0;5;105
"12945";"0332220J";"ECOLE PRIMAIRE CAMARSAC ET CROIGNON";"CAMARSAC";"BORDEAUX";"Rural à habitat dispersé";"PUBLIC";0;8;197
"12982";"0332310G";"ECOLE MATERNELLE PUBLIQUE ALBAN BOUCHE";"IZON";"BORDEAUX";"Petites villes";"PUBLIC";0;10;244
"13087";"0332678G";"ECOLE MATERNELLE PUBLIQUE FONTAINE DES EYQUEMS";"MERIGNAC";"BORDEAUX";"Grands centres urbains";"PUBLIC";0;4;79
"13130";"0332858C";"ECOLE MATERNELLE PUBLIQUE PEYCHOTTE";"MERIGNAC";"BORDEAUX";"Grands centres urbains";"PUBLIC";0;4;96
"13189";"0333381W";"ECOLE PRIMAIRE PUBLIQUE -";"BRACH";"BORDEAUX";"Rural à habitat dispersé";"PUBLIC";0;5;113
"13202";"0333494U";"ECOLE PRIMAIRE PUBLIQUE MODESTE TESTAS";"BORDEAUX";"BORDEAUX";"Grands centres urbains";"PUBLIC";1;20;338
"13205";"0333546A";"ECOLE PRIMAIRE PUBLIQUE ANITA CONTI";"LE TAILLAN-MEDOC";"BORDEAUX";"Grands centres urbains";"PUBLIC";0;5;105
"13207";"0333643F";"ECOLE MATERNELLE PUBLIQUE MALALA YOUSAFZAI";"BEGLES";"BORDEAUX";"Grands centres urbains";"PUBLIC";0;2;45
"13296";"0340322R";"ECOLE PRIMAIRE PUBLIQUE PRE VERT";"CREISSAN";"MONTPELLIER";"Bourgs ruraux";"PUBLIC";0;5;121
"13326";"0340408J";"ECOLE ELEMENTAIRE PUBLIQUE CESAR VINAS";"LODEVE";"MONTPELLIER";"Petites villes";"PUBLIC";0;6;114
"13429";"0340663L";"ECOLE PRIMAIRE PUBLIQUE -";"SAINT-BAUZILLE-DE-MONTMEL";"MONTPELLIER";"Bourgs ruraux";"PUBLIC";0;6;145
"13470";"0340766Y";"ECOLE MATERNELLE PUBLIQUE GASTON BABY";"SETE";"MONTPELLIER";"Centres urbains intermédiaires";"PUBLIC";0;3;57
"13539";"0341122K";"ECOLE PRIMAIRE PUBLIQUE ALBERT CAMUS";"BRIGNAC";"MONTPELLIER";"Bourgs ruraux";"PUBLIC";0;5;109
"13541";"0341159A";"ECOLE PRIMAIRE PRIVEE IMMACULEE CONCEPTION LA SALLE";"BEZIERS";"MONTPELLIER";"Grands centres urbains";"PRIVE";0;14;399
"13553";"0341185D";"ECOLE PRIMAIRE PRIVEE SAINT-JOSEPH";"LODEVE";"MONTPELLIER";"Petites villes";"PRIVE";0;12;289
"13581";"0341247W";"ECOLE PRIMAIRE PUBLIQUE ABEL GAU";"AUTIGNAC";"MONTPELLIER";"Bourgs ruraux";"PUBLIC";0;4;79
"13584";"0341250Z";"ECOLE ELEMENTAIRE PUBLIQUE JOSEPH DELTEIL";"GRABELS";"MONTPELLIER";"Grands centres urbains";"PUBLIC";0;16;391
"13596";"0341287P";"ECOLE MATERNELLE PUBLIQUE GEORGES SAND";"BALARUC-LES-BAINS";"MONTPELLIER";"Ceintures urbaines";"PUBLIC";0;4;75
"13623";"0341342Z";"ECOLE MATERNELLE PUBLIQUE LES GARRIGUES";"JUVIGNAC";"MONTPELLIER";"Ceintures urbaines";"PUBLIC";0;7;183
"13717";"0341642A";"ECOLE ELEMENTAIRE PUBLIQUE DOCTEUR CALMETTE";"MONTPELLIER";"MONTPELLIER";"Grands centres urbains";"PUBLIC";0;8;185
"13786";"0341886R";"ECOLE PRIMAIRE PRIVEE CALANDRETA L'AMETLIER";"BEZIERS";"MONTPELLIER";"Grands centres urbains";"PRIVE";0;12;250
"13869";"0342507R";"ECOLE PRIMAIRE PUBLIQUE SAMUEL PATY";"MONTPELLIER";"MONTPELLIER";"Grands centres urbains";"PUBLIC";1;11;201
"13885";"0350171W";"ECOLE PRIMAIRE PUBLIQUE LES PETITS CAPELLOS";"LA CHAPELLE-AUX-FILTZMEENS";"RENNES";"Rural à habitat dispersé";"PUBLIC";0;5;95
"13901";"0350221A";"ECOLE PRIMAIRE PUBLIQUE ANNE SYLVESTRE";"DINGE";"RENNES";"Rural à habitat dispersé";"PUBLIC";0;6;133
"13903";"0350226F";"ECOLE PRIMAIRE PUBLIQUE LA GLYCINE";"DOMAGNE";"RENNES";"Bourgs ruraux";"PUBLIC";0;8;179
"13909";"0350260T";"ECOLE PRIMAIRE PUBLIQUE LES PRES VERTS";"GAEL";"RENNES";"Rural à habitat dispersé";"PUBLIC";0;4;85
"13962";"0350524E";"ECOLE PRIMAIRE SUZANNE ET RAYMOND GRISON";"SAINT-MEEN-LE-GRAND";"RENNES";"Bourgs ruraux";"PUBLIC";0;14;320
"13964";"0350529K";"ECOLE PRIMAIRE PUBLIQUE LES HIRONDELLES";"MONTAUBAN-DE-BRETAGNE";"RENNES";"Bourgs ruraux";"PUBLIC";0;4;76
"14003";"0350649R";"ECOLE MATERNELLE PUBLIQUE JOSEPH LOTTE";"RENNES";"RENNES";"Grands centres urbains";"PUBLIC";0;6;136
"14028";"0350953W";"ECOLE MATERNELLE PUBLIQUE ROBERT DESNOS";"LIFFRE";"RENNES";"Petites villes";"PUBLIC";0;10;222
"14152";"0351385R";"ECOLE ELEMENTAIRE PRIVEE AMELIE FRISTEL";"SAINT-MALO";"RENNES";"Centres urbains intermédiaires";"PRIVE";0;12;306
"14173";"0351447H";"ECOLE PRIMAIRE PRIVEE ST JOSEPH";"TORCE";"RENNES";"Bourgs ruraux";"PRIVE";0;6;134
"14248";"0351659N";"ECOLE PRIMAIRE PUBLIQUE LE VIEUX MUR";"LANGAN";"RENNES";"Rural à habitat dispersé";"PUBLIC";0;6;144
"14254";"0351665V";"ECOLE ELEMENTAIRE PUBLIQUE ECOLE PUBLIQUE";"MELESSE";"RENNES";"Bourgs ruraux";"PUBLIC";0;13;303
"14261";"0351673D";"ECOLE PRIMAIRE PUBLIQUE LA PETITE COURCIERE";"PLESDER";"RENNES";"Rural à habitat dispersé";"PUBLIC";0;3;57
"14293";"0351737Y";"ECOLE PRIMAIRE PRIVEE ST GUENOLE";"GOVEN";"RENNES";"Bourgs ruraux";"PRIVE";0;7;173
"14320";"0351805X";"ECOLE ELEMENTAIRE PUBLIQUE ECOLE PUBLIQUE";"BEDEE";"RENNES";"Petites villes";"PUBLIC";0;10;228
"14332";"0351823S";"ECOLE ELEMENTAIRE PUBLIQUE EUGENE ALLANIC";"L'HERMITAGE";"RENNES";"Bourgs ruraux";"PUBLIC";0;8;188
"14348";"0351891R";"ECOLE MATERNELLE PUBLIQUE BOURGCHEVREUIL";"CESSON-SEVIGNE";"RENNES";"Grands centres urbains";"PUBLIC";0;7;168
"14384";"0352127X";"ECOLE PRIMAIRE PRIVEE ST JOSEPH STE CROIX";"RETIERS";"RENNES";"Bourgs ruraux";"PRIVE";0;12;265
"14388";"0352134E";"ECOLE ELEMENTAIRE PUBLIQUE GUY GERARD";"PACE";"RENNES";"Centres urbains intermédiaires";"PUBLIC";0;9;201
"14392";"0352139K";"ECOLE MATERNELLE PUBLIQUE JULES FERRY";"RENNES";"RENNES";"Grands centres urbains";"PUBLIC";0;5;113
"14441";"0352321H";"ECOLE PRIMAIRE PUBLIQUE FANNY DUFEIL";"MESNIL-ROC'H";"RENNES";"Rural à habitat dispersé";"PUBLIC";0;10;203
"14486";"0352442P";"ECOLE PRIMAIRE PRIVEE ST JEAN BAPTISTE DE LA SALLE";"MARTIGNE-FERCHAUD";"RENNES";"Bourgs ruraux";"PRIVE";0;6;137
"14525";"0352718P";"ECOLE PRIMAIRE PUBLIQUE ECOLE DES TROIS CHENES";"LAIGNELET";"RENNES";"Bourgs ruraux";"PUBLIC";0;5;122
"14532";"0352844B";"ECOLE PRIMAIRE PUBLIQUE ECOLE COMMUNALE";"SAINT-GANTON";"RENNES";"Rural à habitat très dispersé";"PUBLIC";0;4;82
"14640";"0360352M";"ECOLE ELEMENTAIRE PUBLIQUE -";"PERASSAY";"ORLEANS-TOURS";"Rural à habitat très dispersé";"PUBLIC";0;1;8
"14643";"0360368E";"ECOLE MATERNELLE PUBLIQUE -";"PRISSAC";"ORLEANS-TOURS";"Rural à habitat très dispersé";"PUBLIC";0;1;23
"14709";"0360623G";"ECOLE PRIMAIRE PRIVEE SAINT-PIERRE";"CHATEAUROUX";"ORLEANS-TOURS";"Centres urbains intermédiaires";"PRIVE";0;15;367
"14763";"0370127M";"ECOLE ELEMENTAIRE PUBLIQUE BERT (PAUL)";"LA RICHE";"ORLEANS-TOURS";"Grands centres urbains";"PUBLIC";0;9;204
"14778";"0370215H";"ECOLE ELEMENTAIRE PUBLIQUE MICHELET";"TOURS";"ORLEANS-TOURS";"Grands centres urbains";"PUBLIC";0;5;116
"14781";"0370230Z";"ECOLE ELEMENTAIRE PUBLIQUE BASTIE (MARYSE)";"TOURS";"ORLEANS-TOURS";"Grands centres urbains";"PUBLIC";0;11;239
"14784";"0370256C";"ECOLE PRIMAIRE PUBLIQUE GEOFFROY DE PENNART";"NOYANT-DE-TOURAINE";"ORLEANS-TOURS";"Bourgs ruraux";"PUBLIC";0;3;71
"14800";"0370281E";"ECOLE MATERNELLE PUBLIQUE CURIE (MARIE)";"TOURS";"ORLEANS-TOURS";"Grands centres urbains";"PUBLIC";1;7;122
"14831";"0370340U";"ECOLE ELEMENTAIRE PUBLIQUE -";"SAINT-AUBIN-LE-DEPEINT";"ORLEANS-TOURS";"Rural à habitat dispersé";"PUBLIC";0;1;14
"14832";"0370353H";"ECOLE PRIMAIRE PUBLIQUE -";"CHARNIZAY";"ORLEANS-TOURS";"Rural à habitat très dispersé";"PUBLIC";0;1;23
"15014";"0371140N";"ECOLE PRIMAIRE PUBLIQUE -";"AMBILLOU";"ORLEANS-TOURS";"Bourgs ruraux";"PUBLIC";0;6;139
"15129";"0371613C";"ECOLE PRIMAIRE PUBLIQUE MAUPASSANT-MONTJOYEUX";"TOURS";"ORLEANS-TOURS";"Grands centres urbains";"PUBLIC";0;5;118
"15241";"0380321T";"ECOLE PRIMAIRE BELLEDONNE";"LE CHEYLAS";"GRENOBLE";"Bourgs ruraux";"PUBLIC";0;4;89
"15260";"0380372Y";"ECOLE PRIMAIRE PUBLIQUE -";"CORPS";"GRENOBLE";"Rural à habitat dispersé";"PUBLIC";0;2;40
"15270";"0380397A";"ECOLE MATERNELLE PUBLIQUE LES DAUPHINS";"CREMIEU";"GRENOBLE";"#N/A";"PUBLIC";0;3;77
"15294";"0380464Y";"ECOLE PRIMAIRE PUBLIQUE -";"EYDOCHE";"GRENOBLE";"Rural à habitat dispersé";"PUBLIC";0;3;56
"15322";"0380558A";"ECOLE PRIMAIRE DIDEROT";"GRENOBLE";"GRENOBLE";"Grands centres urbains";"PUBLIC";0;8;190
"15362";"0380721C";"ECOLE PRIMAIRE PUBLIQUE DES SOURCES DES SOURCES";"MEYSSIEZ";"GRENOBLE";"Rural à habitat dispersé";"PUBLIC";0;4;88
"15633";"0381530G";"ECOLE PRIMAIRE PUBLIQUE -";"L'ALBENC";"GRENOBLE";"Bourgs ruraux";"PUBLIC";0;6;126
"15644";"0381564U";"ECOLE MATERNELLE PUBLIQUE LA JALINIERE";"SAINT-SIMEON-DE-BRESSIEUX";"GRENOBLE";"Bourgs ruraux";"PUBLIC";0;4;98
"15680";"0381855K";"ECOLE MATERNELLE PUBLIQUE LES GANDINS";"PLATEAU-DES-PETITES-ROCHES";"GRENOBLE";"Rural à habitat dispersé";"PUBLIC";0;3;68
"15693";"0381924K";"ECOLE ELEMENTAIRE PUBLIQUE JEAN JAURES";"LE VERSOUD";"GRENOBLE";"Ceintures urbaines";"PUBLIC";0;9;217
"15793";"0382212Y";"ECOLE MATERNELLE PUBLIQUE -";"LA FLACHERE";"GRENOBLE";"Bourgs ruraux";"PUBLIC";0;3;65
"15802";"0382233W";"ECOLE MATERNELLE PUBLIQUE LES PETITES MAISONS";"SAINT-MARTIN-D'URIAGE";"GRENOBLE";"Petites villes";"PUBLIC";0;4;101
"15845";"0382308C";"ECOLE MATERNELLE PUBLIQUE -";"LA TERRASSE";"GRENOBLE";"Ceintures urbaines";"PUBLIC";0;3;72
"15925";"0382639M";"ECOLE MATERNELLE PUBLIQUE RENEE BALLET";"SAINT-CHEF";"GRENOBLE";"Rural à habitat dispersé";"PUBLIC";0;5;118
"15928";"0382648X";"ECOLE ELEMENTAIRE PUBLIQUE LA MAIRIE";"FONTAINE";"GRENOBLE";"Grands centres urbains";"PUBLIC";1;5;80
"16000";"0382843J";"ECOLE ELEMENTAIRE PUBLIQUE JULES BRUANT";"VAULNAVEYS-LE-HAUT";"GRENOBLE";"Petites villes";"PUBLIC";0;10;241
"16023";"0382902Y";"ECOLE ELEMENTAIRE PUBLIQUE -";"PORCIEU-AMBLAGNIEU";"GRENOBLE";"Bourgs ruraux";"PUBLIC";0;5;113
"16064";"0383017Y";"ECOLE PRIMAIRE PUBLIQUE DE LA FRATERNITE";"BREZINS";"GRENOBLE";"Bourgs ruraux";"PUBLIC";0;9;210
"16099";"0383154X";"ECOLE PRIMAIRE PUBLIQUE SIMONE VEIL";"MOIRANS";"GRENOBLE";"Ceintures urbaines";"PUBLIC";0;13;303
"16152";"0390303T";"ECOLE PRIMAIRE PUBLIQUE -";"SIROD";"BESANCON";"Rural à habitat dispersé";"PUBLIC";0;3;51
"16184";"0390424Z";"ECOLE PRIMAIRE PUBLIQUE -";"MIGNOVILLARD";"BESANCON";"Bourgs ruraux";"PUBLIC";0;6;134
"16230";"0390601S";"ECOLE PRIMAIRE PUBLIQUE -";"MONTHOLIER";"BESANCON";"Rural à habitat dispersé";"PUBLIC";0;1;17
"16270";"0390731H";"ECOLE PRIMAIRE PAUL CHARMIGNEY";"VAUX-LES-SAINT-CLAUDE";"BESANCON";"Bourgs ruraux";"PUBLIC";0;3;60
"16304";"0390901T";"ECOLE PRIMAIRE PUBLIQUE AVIGNONNETS";"SAINT-CLAUDE";"BESANCON";"Centres urbains intermédiaires";"PUBLIC";1;9;127
"16376";"0400165M";"ECOLE ELEMENTAIRE PUBLIQUE BOURG";"MORCENX-LA-NOUVELLE";"BORDEAUX";"Bourgs ruraux";"PUBLIC";0;1;22
"16386";"0400186K";"ECOLE ELEMENTAIRE PUBLIQUE PETIT PRINCE";"BISCARROSSE";"BORDEAUX";"Petites villes";"PUBLIC";0;8;160
"16437";"0400297F";"ECOLE ELEMENTAIRE PUBLIQUE -";"BASTENNES";"BORDEAUX";"Rural à habitat dispersé";"PUBLIC";0;1;23
"16469";"0400366F";"ECOLE MATERNELLE PUBLIQUE -";"LAMOTHE";"BORDEAUX";"Rural à habitat dispersé";"PUBLIC";0;1;18
"16533";"0400514S";"ECOLE ELEMENTAIRE PUBLIQUE -";"MORGANX";"BORDEAUX";"Rural à habitat très dispersé";"PUBLIC";0;1;17
"16586";"0400643G";"ECOLE PRIMAIRE PUBLIQUE -";"SAINT-MARTIN-DE-HINX";"BORDEAUX";"Rural à habitat dispersé";"PUBLIC";0;8;204
"16610";"0400714J";"ECOLE PRIMAIRE PRIVEE NOTRE DAME";"SOUSTONS";"BORDEAUX";"Petites villes";"PRIVE";0;4;100
"16611";"0400715K";"ECOLE ELEMENTAIRE PRIVEE SAINT JOSEPH";"TARTAS";"BORDEAUX";"Bourgs ruraux";"PRIVE";0;7;182
"16621";"0400736H";"ECOLE MATERNELLE PUBLIQUE BIARNES";"SAINT-PIERRE-DU-MONT";"BORDEAUX";"Centres urbains intermédiaires";"PUBLIC";0;4;82
"16656";"0400814T";"ECOLE PRIMAIRE PUBLIQUE -";"POMAREZ";"BORDEAUX";"Rural à habitat dispersé";"PUBLIC";0;6;120
"16701";"0400983B";"ECOLE ELEMENTAIRE PUBLIQUE MEYRIE";"BISCARROSSE";"BORDEAUX";"Petites villes";"PUBLIC";0;12;279
"16711";"0401035H";"ECOLE ELEMENTAIRE PUBLIQUE DANIEL POUEYMIDOU";"TARNOS";"BORDEAUX";"Ceintures urbaines";"PUBLIC";0;7;127
"16811";"0410357R";"ECOLE PRIMAIRE -";"PRUNAY-CASSEREAU";"ORLEANS-TOURS";"Rural à habitat dispersé";"PUBLIC";0;2;49
"16832";"0410420J";"ECOLE ELEMENTAIRE PUBLIQUE -";"SAINT-LOUP";"ORLEANS-TOURS";"Rural à habitat dispersé";"PUBLIC";0;1;23
"16936";"0410778Y";"ECOLE MATERNELLE PUBLIQUE -";"MONDOUBLEAU";"ORLEANS-TOURS";"Bourgs ruraux";"PUBLIC";0;2;47
"16939";"0410781B";"ECOLE PRIMAIRE PUBLIQUE -";"BEAUCE LA ROMAINE";"ORLEANS-TOURS";"Rural à habitat dispersé";"PUBLIC";0;13;283
"16946";"0410788J";"ECOLE PRIMAIRE PRIVEE STE MARIE MONSABRE";"BLOIS";"ORLEANS-TOURS";"Centres urbains intermédiaires";"PRIVE";0;6;141
"16994";"0410901G";"ECOLE ELEMENTAIRE PUBLIQUE RENE MASSON";"BRACIEUX";"ORLEANS-TOURS";"Bourgs ruraux";"PUBLIC";0;4;75
"17035";"0420149J";"ECOLE PRIMAIRE PUBLIQUE LA MARELLE PRIMAIRE";"LE CERGNE";"LYON";"Rural à habitat dispersé";"PUBLIC";0;4;74
"17048";"0420199N";"ECOLE PRIMAIRE PUBLIQUE LE BOURG PRIMAIRE";"CHATELNEUF";"LYON";"Rural à habitat dispersé";"PUBLIC";0;2;29
"17090";"0420311K";"ECOLE MATERNELLE PUBLIQUE RUE DE GRUYERES MATERNELLE";"RENAISON";"LYON";"Bourgs ruraux";"PUBLIC";0;4;81
"17115";"0420417A";"ECOLE PRIMAIRE PUBLIQUE BOURG PRIMAIRE";"PARIGNY";"LYON";"Rural à habitat dispersé";"PUBLIC";0;4;83
"17166";"0420561G";"ECOLE MATERNELLE PUBLIQUE LE BOURG MATERNELLE";"SAINT-CYR-DE-VALORGES";"LYON";"Rural à habitat dispersé";"PUBLIC";0;1;13
"17187";"0420708S";"ECOLE MATERNELLE PUBLIQUE PASTEUR MATERNELLE";"SAINT-GENEST-LERPT";"LYON";"Ceintures urbaines";"PUBLIC";0;7;165
"17234";"0420855B";"ECOLE PRIMAIRE PUBLIQUE LE BOURG PRIMAIRE";"LA TERRASSE-SUR-DORLAY";"LYON";"Rural à habitat dispersé";"PUBLIC";0;3;64
"17237";"0420870T";"ECOLE ELEMENTAIRE PUBLIQUE LE BOURG ELEMENTAIRE";"LA TUILIERE";"LYON";"Rural à habitat très dispersé";"PUBLIC";0;1;14
"17289";"0421271D";"ECOLE PRIMAIRE PRIVEE ST JOSEPH";"NEULISE";"LYON";"Bourgs ruraux";"PRIVE";0;4;87
"17411";"0421706B";"ECOLE PRIMAIRE PUBLIQUE MONTREYNAUD VIVALDI PRIMAIRE";"SAINT-ETIENNE";"LYON";"Grands centres urbains";"PUBLIC";1;7;114
"17457";"0421867B";"ECOLE MATERNELLE PUBLIQUE BERKELEY MATERNELLE";"SAINT-ETIENNE";"LYON";"Grands centres urbains";"PUBLIC";0;4;87
"17472";"0421914C";"ECOLE PRIMAIRE PUBLIQUE RUE DU COMMERCE PRIMAIRE";"SAINT-MARTIN-D'ESTREAUX";"LYON";"Rural à habitat dispersé";"PUBLIC";0;3;67
"17513";"0422009F";"ECOLE ELEMENTAIRE PUBLIQUE TILLEULS ELEMENTAIRE";"SAINT-JUST-SAINT-RAMBERT";"LYON";"Ceintures urbaines";"PUBLIC";0;11;271
"17646";"0430349W";"ECOLE ELEMENTAIRE PUBLIQUE SAINT-GENEYS-PRES-ST-PAULIEN";"SAINT-GENEYS-PRES-SAINT-PAULIEN";"CLERMONT-FERRAND";"Rural à habitat dispersé";"PUBLIC";0;2;31
"17705";"0430504P";"ECOLE MATERNELLE PUBLIQUE MARTHE CHAZAL";"SAINTE-FLORINE";"CLERMONT-FERRAND";"Petites villes";"PUBLIC";0;1;15
"17722";"0430565F";"ECOLE ELEMENTAIRE PUBLIQUE QUEYRIERES";"QUEYRIERES";"CLERMONT-FERRAND";"Rural à habitat dispersé";"PUBLIC";0;2;27
"17762";"0430727G";"ECOLE ELEMENTAIRE PRIVEE SAINT JOSEPH";"MONTFAUCON-EN-VELAY";"CLERMONT-FERRAND";"Bourgs ruraux";"PRIVE";0;4;74
"17765";"0430733N";"ECOLE ELEMENTAIRE PRIVEE GUITTARD";"LE PUY-EN-VELAY";"CLERMONT-FERRAND";"Centres urbains intermédiaires";"PRIVE";0;3;64
"17962";"0440632Y";"ECOLE PRIMAIRE PUBLIQUE COUDRAY (LE)";"NANTES";"NANTES";"Grands centres urbains";"PUBLIC";0;12;271
"17990";"0440684E";"ECOLE ELEMENTAIRE PUBLIQUE STALINGRAD";"NANTES";"NANTES";"Grands centres urbains";"PUBLIC";0;7;149
"17997";"0440693P";"ECOLE MATERNELLE PUBLIQUE SARAH BERNHARDT";"NANTES";"NANTES";"Grands centres urbains";"PUBLIC";0;8;202
"18010";"0440710H";"ECOLE MATERNELLE PUBLIQUE URBAIN LE VERRIER";"NANTES";"NANTES";"Grands centres urbains";"PUBLIC";1;11;192
"18055";"0440781K";"ECOLE PRIMAIRE PUBLIQUE CLEMENT PELLERIN";"LA REGRIPPIERE";"NANTES";"Rural à habitat dispersé";"PUBLIC";0;4;77
"18244";"0441155S";"ECOLE PRIMAIRE PRIVEE STE MARIE";"HERBIGNAC";"NANTES";"Rural à habitat dispersé";"PRIVE";0;8;204
"18292";"0441252X";"ECOLE PRIMAIRE PRIVEE STE MARIE";"NOZAY";"NANTES";"Bourgs ruraux";"PRIVE";0;8;208
"18443";"0441606G";"ECOLE PRIMAIRE PUBLIQUE ALEXANDRE BERNARD";"ANCENIS-SAINT-GEREON";"NANTES";"Petites villes";"PUBLIC";0;6;139
"18505";"0441852Z";"ECOLE PRIMAIRE PRIVEE ST AUBIN";"GUERANDE";"NANTES";"Ceintures urbaines";"PRIVE";0;13;337
"18645";"0450164J";"ECOLE PRIMAIRE -";"VILLEMURLIN";"ORLEANS-TOURS";"Rural à habitat dispersé";"PUBLIC";0;2;46
"18671";"0450233J";"ECOLE MATERNELLE PUBLIQUE MARC O'NEILL";"LORRIS";"ORLEANS-TOURS";"Bourgs ruraux";"PUBLIC";0;6;101
"18890";"0451047U";"ECOLE MATERNELLE PUBLIQUE LE PETIT PRINCE";"PATAY";"ORLEANS-TOURS";"Bourgs ruraux";"PUBLIC";0;5;121
"18899";"0451065N";"ECOLE PRIMAIRE PRIVEE SAINT MARCEAU";"ORLEANS";"ORLEANS-TOURS";"Grands centres urbains";"PRIVE";0;17;461
